{
  "schemaVersion": "1.0",
  "scope": "live_http_sse_agent_evaluation_not_manufacturing_approval",
  "planId": "ratsnest-supported-golden-boards-v1",
  "planDigest": "85fdbca5afe0b686c7ed8664fa238a8ebd1e9c9738b299c3d893eeb4c7a3bedc",
  "sourceCommit": "f66ee1f0e233ff11b2f357de57d4ec07f0808c53",
  "sourceDirty": true,
  "frozenExecution": null,
  "createdAt": "2026-08-28T13:11:59.361325+00:00",
  "cases": [
    {
      "caseId": "golden.02-stm32f030-minimal-board",
      "category": "eda_pipeline",
      "arm": null,
      "pairId": null,
      "frozenInputDigest": "648671c3e8b657017d9bef4c710eb1c09db5b6fdefbf4b4a55b5d143f834d2a9",
      "expectedTerminal": "completed",
      "requestFingerprint": "fd6cbd37cbfeb9bb91e2cd1fa2736fa554f20694ac02092544930dcfbdecfd70",
      "observed": {
        "httpStatus": 200,
        "durationSeconds": 0.125,
        "done": false,
        "humanInput": true,
        "errors": [],
        "intent": "build",
        "phases": [
          "intent-router"
        ],
        "tools": [],
        "toolCalls": [],
        "handoffs": null,
        "handoffErrorCount": null,
        "hitl": {
          "requestCount": 1,
          "responseCount": null,
          "responseLatencySeconds": null
        },
        "completedSteps": 0,
        "llmTokens": 0,
        "deliveryStatus": null,
        "artifacts": [],
        "artifactsValid": true,
        "eventDigest": "63ea1ee9a66258459c3a6fba826ea87a7515b2bef87ca45dc6ac922c00a4bccf"
      },
      "replay": null,
      "checks": {
        "intent": true,
        "requiredPhases": false,
        "forbiddenPhases": true,
        "requiredTools": false,
        "forbiddenTools": true,
        "terminal": false,
        "artifacts": false,
        "releaseGate": false,
        "edaPipeline": false,
        "replay": true,
        "toolEvidence": null,
        "handoffEvidence": null
      },
      "humanAcceptance": null,
      "passed": false
    },
    {
      "caseId": "golden.03-stm32g070-controller",
      "category": "eda_pipeline",
      "arm": null,
      "pairId": null,
      "frozenInputDigest": "6a8e8091645a9d8b164faebfa0b3e0064d223809f712fcf31ffa1a73f471769a",
      "expectedTerminal": "completed",
      "requestFingerprint": "87ceb93e9f53097e2e780c64e01a66e68a012bce9183fb88214838d8afb3700f",
      "observed": {
        "httpStatus": 200,
        "durationSeconds": 0.062,
        "done": false,
        "humanInput": true,
        "errors": [],
        "intent": "build",
        "phases": [
          "intent-router"
        ],
        "tools": [],
        "toolCalls": [],
        "handoffs": null,
        "handoffErrorCount": null,
        "hitl": {
          "requestCount": 1,
          "responseCount": null,
          "responseLatencySeconds": null
        },
        "completedSteps": 0,
        "llmTokens": 0,
        "deliveryStatus": null,
        "artifacts": [],
        "artifactsValid": true,
        "eventDigest": "63ea1ee9a66258459c3a6fba826ea87a7515b2bef87ca45dc6ac922c00a4bccf"
      },
      "replay": null,
      "checks": {
        "intent": true,
        "requiredPhases": false,
        "forbiddenPhases": true,
        "requiredTools": false,
        "forbiddenTools": true,
        "terminal": false,
        "artifacts": false,
        "releaseGate": false,
        "edaPipeline": false,
        "replay": true,
        "toolEvidence": null,
        "handoffEvidence": null
      },
      "humanAcceptance": null,
      "passed": false
    }
  ],
  "armMetrics": {
    "single_agent": {
      "caseCount": 0,
      "transportCompletionRate": null,
      "protocolCompletionRate": null,
      "pipeline17StepCompletionRate": null,
      "strictTaskSuccessRate": null,
      "releaseReadyRate": null,
      "releaseStatusObservationCoverage": null,
      "humanAcceptanceRate": null,
      "humanReviewCoverage": null,
      "phaseContractErrorRate": null,
      "toolContractErrorRate": null,
      "meanDurationSeconds": null,
      "medianDurationSeconds": null,
      "p95DurationSeconds": null,
      "hitlInterventionRate": null,
      "hitlRequestCount": null,
      "toolArgumentSchemaValidityRate": null,
      "toolPostconditionPassRate": null,
      "observedToolCallCount": 0,
      "handoffEvidenceStatus": "not_applicable",
      "observedHandoffCount": null,
      "handoffErrorCount": null,
      "handoffErrorRate": null
    },
    "multi_agent": {
      "caseCount": 0,
      "transportCompletionRate": null,
      "protocolCompletionRate": null,
      "pipeline17StepCompletionRate": null,
      "strictTaskSuccessRate": null,
      "releaseReadyRate": null,
      "releaseStatusObservationCoverage": null,
      "humanAcceptanceRate": null,
      "humanReviewCoverage": null,
      "phaseContractErrorRate": null,
      "toolContractErrorRate": null,
      "meanDurationSeconds": null,
      "medianDurationSeconds": null,
      "p95DurationSeconds": null,
      "hitlInterventionRate": null,
      "hitlRequestCount": null,
      "toolArgumentSchemaValidityRate": null,
      "toolPostconditionPassRate": null,
      "observedToolCallCount": 0,
      "handoffEvidenceStatus": "missing",
      "observedHandoffCount": null,
      "handoffErrorCount": null,
      "handoffErrorRate": null
    }
  },
  "pairedComparison": {
    "pairCount": 0,
    "completePairCount": 0,
    "incompletePairCount": 0,
    "deltaDenominatorCompletePairs": 0,
    "deltaConvention": "multi_agent_minus_single_agent",
    "completePairArmMetrics": {
      "single_agent": {
        "caseCount": 0,
        "transportCompletionRate": null,
        "protocolCompletionRate": null,
        "pipeline17StepCompletionRate": null,
        "strictTaskSuccessRate": null,
        "releaseReadyRate": null,
        "releaseStatusObservationCoverage": null,
        "humanAcceptanceRate": null,
        "humanReviewCoverage": null,
        "phaseContractErrorRate": null,
        "toolContractErrorRate": null,
        "meanDurationSeconds": null,
        "medianDurationSeconds": null,
        "p95DurationSeconds": null,
        "hitlInterventionRate": null,
        "hitlRequestCount": null,
        "toolArgumentSchemaValidityRate": null,
        "toolPostconditionPassRate": null,
        "observedToolCallCount": 0,
        "handoffEvidenceStatus": "not_applicable",
        "observedHandoffCount": null,
        "handoffErrorCount": null,
        "handoffErrorRate": null
      },
      "multi_agent": {
        "caseCount": 0,
        "transportCompletionRate": null,
        "protocolCompletionRate": null,
        "pipeline17StepCompletionRate": null,
        "strictTaskSuccessRate": null,
        "releaseReadyRate": null,
        "releaseStatusObservationCoverage": null,
        "humanAcceptanceRate": null,
        "humanReviewCoverage": null,
        "phaseContractErrorRate": null,
        "toolContractErrorRate": null,
        "meanDurationSeconds": null,
        "medianDurationSeconds": null,
        "p95DurationSeconds": null,
        "hitlInterventionRate": null,
        "hitlRequestCount": null,
        "toolArgumentSchemaValidityRate": null,
        "toolPostconditionPassRate": null,
        "observedToolCallCount": 0,
        "handoffEvidenceStatus": "missing",
        "observedHandoffCount": null,
        "handoffErrorCount": null,
        "handoffErrorRate": null
      }
    },
    "metricDeltas": {
      "transportCompletionRate": null,
      "protocolCompletionRate": null,
      "pipeline17StepCompletionRate": null,
      "strictTaskSuccessRate": null,
      "releaseReadyRate": null,
      "humanAcceptanceRate": null,
      "phaseContractErrorRate": null,
      "toolContractErrorRate": null,
      "meanDurationSeconds": null,
      "medianDurationSeconds": null,
      "p95DurationSeconds": null,
      "hitlInterventionRate": null,
      "toolArgumentSchemaValidityRate": null,
      "toolPostconditionPassRate": null
    },
    "pairs": []
  },
  "metrics": {
    "caseCount": 2,
    "passedCases": 0,
    "passRate": 0.0,
    "transportCompletionRate": 1.0,
    "protocolCompletionRate": 0.0,
    "pipelineCompletionRate": 0.0,
    "releaseReadyRate": 0.0,
    "intentAccuracy": 1.0,
    "toolContractAccuracy": 0.5,
    "gateAccuracy": 0.0,
    "edaPipelineAccuracy": 0.0,
    "toolEvidenceAccuracy": null,
    "observedToolCallCount": 0,
    "toolArgumentSchemaValidityRate": null,
    "toolPostconditionPassRate": null,
    "toolResultStatusCoverageRate": null,
    "handoffEvidenceAccuracy": null,
    "handoffErrorCount": null,
    "humanAcceptanceRate": null,
    "humanReviewedCaseCount": 0,
    "hitlRequestCount": 2,
    "hitlResponseCount": null,
    "pairCount": 0,
    "completePairCount": 0,
    "falseReleaseCount": 0,
    "totalLlmTokens": 0,
    "totalWallClockSeconds": 0.187
  }
}
